Atlanta Science Festival,Fernbank Forest Native Plants & Wildflower Tour,"Join a Fernbank scientist to explore Fernbank Forest, a 65-acre mature mixed-hardwood forest located in the heart of metro Atlanta. Participants will explore the diversity of native plants and wildflowers and learn to identify them by their leaves and flowers. This tour is for ages 8 and up. Children under age 16 must be accompanied by an adult. Call 404.929.6400 to reserve your spot. Space is limited to 30 people, so make your reservation early!... More Details AUDIENCE(S): Children (5-12 yrs) Teens (13-18 yrs) Families (kids & adults together) Adults",https://atlantasciencefestival.org/events-2019/fernbank-forest-native-plants-wildflower-tour/,Atlanta,,2019-03-21,2019-03-21,14:00,16:00,,,,,,No
Atlanta Science Festival,"Bio-Bus: Chemistry: Acids, Bases & Indicators","Put on your goggles, don your gloves and become a junior chemist as you learn about the building blocks of chemistry: acids and bases. Explore the properties of these solutions and join the Bio-Bus as we put a creative spin on learning how these chemicals behave together, and of course...participate in a few reactive demonstrations! To sign up for this event, contact Gretchen Schweers at 404-679-4404. Parents need only register for their child (children), not... More Details AUDIENCE(S): Families (kids & adults together) Children (5-12 yrs) Teens (13-18 yrs)",https://atlantasciencefestival.org/events-2019/bio-bus-chemistry-acids-bases-indicators/,Decatur,,2019-03-21,2019-03-21,14:30,16:30,,,,,,No
Atlanta Science Festival,CDC Museum Open House,"Learn about CDC's work through the exhibits at CDC Museum. As you wander our space seeing artifacts from our historic collection, we'll have CDC expert docents on hand to answer your questions! Parking available on site. More Details AUDIENCE(S): Adults Teens (13-18 yrs) Families (kids & adults together)",https://atlantasciencefestival.org/events-2019/cdc-museum-open-house/,Atlanta,,2019-03-21,2019-03-21,16:00,19:00,,,,,,No
Atlanta Science Festival,Become an Archaeologist,"How did people live in the past? Archaeologists are the detectives of science, working to answer this question. Join Emory University experts for a set of activities where you can learn how to extract DNA, perform chemical analysis to discover the uses of artifacts, and put ancient objects and skeletons back together like a puzzle. Parents and kids alike can ask Emory anthropologists about their work and hear about the latest discoveries in the field. More Details AUDIENCE(S): Families (kids & adults together) Children (5-12 yrs)",https://atlantasciencefestival.org/events-2019/become-an-archaeologist/,Atlanta,,2019-03-21,2019-03-21,18:00,20:00,,,,,,No
Atlanta Science Festival,Gwinnett 4-H Wacky Science Night from UGA Extension,How do computers understand code? Have you ever wanted to do some crazy chemistry from the kitchen? Join us for a night of science exploration and mystery where we answer these questions and more. You will be in for some wacky science experiments where youth and parents will get a chance to become a mad scientists with Gwinnett 4-H ers. Drop in any time during the event! More Details AUDIENCE(S): Families (kids & adults together) Children (5-12 yrs) Teens (13-18 yrs),https://atlantasciencefestival.org/events-2019/gwinnett-4-h-wacky-science-night-from-uga-extension/,Lawrenceville,,2019-03-21,2019-03-21,18:30,20:00,,,,,,No
Atlanta Science Festival,Ada and the Engine,"Ada Lovelace: mathematician, poet, first computer programmer. Ada and the Engine is a play that portrays Ada's struggles as a female in a field of only men and highlights the same struggles that women still have today in STEM. Come see the play and the multimedia gallery portraying women throughout history in STEM fields. Following select performances, we will have a talk back about the themes of the play. Directions and parking Take I-20 East to... More Details AUDIENCE(S): Adults Teens (13-18 yrs)",https://atlantasciencefestival.org/events-2019/ada-and-the-engine-1/,Oxford,,2019-03-21,2019-03-21,19:30,21:30,,,,,,No
Atlanta Science Festival,Math Trivia: Fun to the (n+1)st Degree!,"What s a positive integer (n) such that n-1 is a perfect square and n+1 is a perfect cube? What statistical term for a measure of center is also the word for the center of a divided highway? What noble title do Baltar, Olaf, Dooku, Nefaria, and Chocula share? If you answered ""26"", ""Median"", and ""Count"", then come out and play! Enjoy trivia questions   computational and pop cultural   and compete for fabulous prizes! You ll... More Details AUDIENCE(S): Adults",https://atlantasciencefestival.org/events-2019/math-trivia-fun-to-the-n-plus-one-1st-degree/,Avondale,,2019-03-21,2019-03-21,19:30,21:30,,,,,,No
Atlanta Science Festival,Science for EveryBODY,"Join us as we take a tour through the human body and explore the inner workings of the amazing place we call home. Peer through a microscope, touch a real brain, see the inside of a real heart, and interact with exciting exhibits designed to help kids from 2 to 102 better understand how we live, breathe, work, and smile. More Details AUDIENCE(S): Families (kids & adults together) Teens (13-18 yrs) Children (5-12 yrs) Preschool (0-4 yrs)",https://atlantasciencefestival.org/events-2019/science-for-everybody/,Acworth,,2019-03-22,2019-03-22,09:00,15:00,,,,,,No
Atlanta Science Festival,"Galapagos George, the Little Tortoise That Could: A Puppetry Adventure!","Join the Center for Puppetry Arts and Barefoot Puppet Theatre as they introduce you to Galapagos George, the Little Tortoise That Could! Your amazing Atlanta Science Festival experience will include a puppet show, a Create-A-Puppet WorkshopTM, the Worlds of Puppetry Museum with specialized learning stations, AND a special appearance by some reptilian friends visiting from the Amphibian Foundation! Have a blast learning about animals, ecology, and the STEAM of puppetry. Note that this show... More Details AUDIENCE(S): Families (kids & adults together) Children (5-12 yrs)",https://atlantasciencefestival.org/events-2019/galapagos-george-the-little-tortoise-that-could-a-puppetry-adventure-1/,Atlanta,,2019-03-22,2019-03-22,10:00,12:00,,,,,,No
Atlanta Science Festival,"Galapagos George, the Little Tortoise That Could: A Puppetry Adventure!","Join the Center for Puppetry Arts and Barefoot Puppet Theatre as they introduce you to Galapagos George, the Little Tortoise That Could! Your amazing Atlanta Science Festival experience will include a puppet show, a Create-A-Puppet WorkshopTM, the Worlds of Puppetry Museum with specialized learning stations, AND a special appearance by some reptilian friends visiting from the Amphibian Foundation! Have a blast learning about animals, ecology, and the STEAM of puppetry. Note that this show... More Details AUDIENCE(S): Families (kids & adults together) Children (5-12 yrs)",https://atlantasciencefestival.org/events-2019/galapagos-george-the-little-tortoise-that-could-a-puppetry-adventure-2/,Atlanta,,2019-03-22,2019-03-22,11:30,13:30,,,,,,No
Atlanta Science Festival,Chemistry Carnival,"Come one, come all, to the Chemistry Carnival! Learn about the cutting-edge research Emory studies through carnival games like Peptide Jenga and Bacterial Telepathy! Prizes will be awarded and scientists will be on site to explain the laboratory research hiding behind each fun game concept. Great field trip opportunity! Nearbyparking is available in the Peavine Visitor Lot and the Oxford Road Vistor's Deck. See details here. The Peavine Lot is free beginning at 5pm. More Details AUDIENCE(S): Families (kids & adults together) Children (5-12 yrs) Teens (13-18 yrs)",https://atlantasciencefestival.org/events-2019/chemistry-carnival/,Atlanta,,2019-03-22,2019-03-22,15:30,19:00,,,,,,No
Atlanta Science Festival,Physics Live!,"Ever play with giant soap bubbles, ride a hovercraft, or taste liquid nitrogen ice cream? How about journey through space and time as you gaze at the stars? Now you can with Physics Live! Come join the faculty and students at Emory University s Department of Physics for an afternoon and evening of science exploration! Loads of exciting demonstrations (K-12 encouraged), Planetarium shows (limited seating, tickets available upon arrival), and Laboratory tours (research in action!). A... More Details AUDIENCE(S): Families (kids & adults together) Preschool (0-4 yrs) Children (5-12 yrs)",https://atlantasciencefestival.org/events-2019/physics-live/,Atlanta,,2019-03-22,2019-03-22,15:30,19:00,,,,,,No
Atlanta Science Festival,Animals - Just Like Us!,"Bridget Heos, author of the Just Like Us! series of books, discusses with kids the various ways that humans share similarities to other living things. Cats enjoy naps. Birds decorate their homes. Fish go to school (and find safety in numbers). Plants drink water. Ants build roads. This just scratches the surface! Books will be available for sale at the event and Bridget will sign them! Paid street parking is available. More Details AUDIENCE(S): Families (kids & adults together) Children (5-12 yrs)",https://atlantasciencefestival.org/events-2019/animals-just-like-us/,Decatur,,2019-03-22,2019-03-22,18:00,19:00,,,,,,No
Atlanta Science Festival,Citizen Science Mini-Hackathon Workshop,"Do you want to learn how to code AND to help your community? Come to our mini-Hackathon workshop and learn the basics for how to develop websites, games, phone apps, and more to benefit the health of your community. After completion of this workshop, you will be fully prepared to participate in our all-girls Hackathon. A light dinner will be served. Nearby free parking is available in the Peavine Visitor Lot and the Oxford Road... More Details AUDIENCE(S): Children (5-12 yrs) Teens (13-18 yrs)",https://atlantasciencefestival.org/events-2019/citizen-science-mini-hackathon-workshop/,Atlanta,,2019-03-22,2019-03-22,18:00,21:00,,,,,,No
Atlanta Science Festival,Critters & Cabernet,"Reptiles and Wine?! What could go wrong? Join us for an extremely hands-on approach to learning about this fascinating group of animals. Heck, we'll even get to know some amphibians too! Frogs, salamanders, turtles, lizards and snakes will be present to explore. Your ticket includes access to the event and one drink. Additional drinks may be purchased on site. Free parking is available on site. More Details AUDIENCE(S): Adults",https://atlantasciencefestival.org/events-2019/critters-cabernet/,Atlanta,,2019-03-22,2019-03-22,19:30,21:00,,,,,,No
Atlanta Science Festival,Ada and the Engine,"Ada Lovelace: mathematician, poet, first computer programmer. Ada and the Engine is a play that portrays Ada's struggles as a female in a field of only men and highlights the same struggles that women still have today in STEM. Come see the play and the multimedia gallery portraying women throughout history in STEM fields. Following select performances ,we will have a talk back about the themes of the play. Directions and parking Take I-20 East to... More Details AUDIENCE(S): Adults Teens (13-18 yrs)",https://atlantasciencefestival.org/events-2019/ada-and-the-engine-2/,Oxford,,2019-03-22,2019-03-22,19:30,21:30,,,,,,No
Atlanta Science Festival,Intro to Curling: Exploring the Boundary Where Granite Meets Ice,"SOLD OUT. Please check back in late February to see if we ve had any cancellations.You've seen that Winter Olympic sport with the rocks and sweeping and yelling, but do you know what's actually going on? Sign up for this 2 hour class with the Atlanta Curling Club and we'll explain everything as you learn step-by-step how to throw a stone and sweep it into the ""house."" We ll cover sweeping, collisions, why the stone  curls  in... More Details AUDIENCE(S): Adults Teens (13-18 yrs)",https://atlantasciencefestival.org/events-2019/intro-to-curling-exploring-the-boundary-where-granite-meets-ice-2/,Sandy,,2019-03-22,2019-03-22,19:30,21:30,,,,,,No
Atlanta Science Festival,March for Science - Atlanta,"March for Science Atlanta is back by popular demand, so grab your signs and bring your friends to march with us along the Beltline to the finale event of the Atlanta Science Festival in Piedmont Park! Join the global movement to let your leaders and lawmakers know that you value science and evidence-based policies. This year we are raising money to support Science ATL's Chief Science Officer program. Form a fundraising team and come in... More Details AUDIENCE(S): Families (kids & adults together) Adults Teens (13-18 yrs) Children (5-12 yrs)",https://atlantasciencefestival.org/events-2019/march-for-science-atlanta/,Atlanta,,2019-03-23,2019-03-23,10:00,12:00,,,,,,No
Atlanta Science Festival,Exploration Expo,"Atlanta s biggest interactive science event is FREE and open to adults, families, and children of all ages and interests. Save the date for Atlanta s biggest interactive science event, featuring 100 interactive exhibits, hands-on experiments, and mind-blowing demos from local universities, businesses, and community organizations! More Details AUDIENCE(S): Adults Families (kids & adults together) Teens (13-18 yrs) Children (5-12 yrs) Preschool (0-4 yrs)",https://atlantasciencefestival.org/events-2019/exploration-expo/,Atlanta,,2019-03-23,2019-03-23,11:00,16:00,,,,,,No
