Atlanta Science Festival,Science of Wine,"THIS EVENT IS SOLD OUT. Uncork your inner sommelier with City Winery at The Atlanta Science Festival! Winemaker Travis Green will lead a private, seated wine class that s sure to impress any wine lover. After a brief introduction to wine tasting, you ll learn about vineyard biology and the science behind the winemaking process   all while tasting two different flights of delicious wine. The class will finish with a dessert wine followed by an interactive Q&A... More Details AUDIENCE(S): Adults",https://atlantasciencefestival.org/events-2019/science-of-wine/,Atlanta,,2019-03-16,2019-03-16,18:00,19:30,,,,,,No
Atlanta Science Festival,Solve for X Variety Show,"This internationally touring variety show is full of professional writers, comedians, and more performing acts based on actual scientific studies. This 60-to-90 minute high-energy show is chock full of hilarity, artistry, and even a little bit of learning. Grab a drink, pull up a chair, and witness the uninhibited and after-hours side of science. 18+ only. Limited free parking is available in the adjacent lot and in nearby streets. Paid parking is available in the... More Details AUDIENCE(S): Adults",https://atlantasciencefestival.org/events-2019/solve-for-x-variety-show/,Atlanta,,2019-03-16,2019-03-16,20:30,22:00,,,,,,No
Atlanta Science Festival,Starry Night,"Come out for a telescopic tour of the evening sky, see objects in our solar system and beyond, and learn about the exciting astronomy research done at Georgia State. GSU astronomers will give you access to their research telescopes along with smaller telescopes to show you the observable stars and planets in our night sky, weather permitting. Limited parking is available, please consider carpooling, and drive carefully. If you use GPS, please type in the longitude/latitude or... More Details AUDIENCE(S): Families (kids & adults together) Teens (13-18 yrs) Adults Children (5-12 yrs)",https://atlantasciencefestival.org/events-2019/starry-night/,Rutledge,,2019-03-16,2019-03-16,20:30,22:30,,,,,,No
Atlanta Science Festival,Silver Scream Science Spookshow,"Your ghost host with the most, Professor Morte', brings you a special SCIENCE version of the Silver Scream Spookshow for the Atlanta Science Festival! Morte' and his gang of ghouls will entertain you before the film and your favorite genetically-modified rock band, Leucine Zipper and the Zinc Fingers, will play before the show! Tickets available at the door. Doors open at 10 p.m. Note: This is the late night show for adults. A family friendly matinee... More Details AUDIENCE(S): Adults",https://atlantasciencefestival.org/events-2019/silver-scream-science-spookshow-2/,Atlanta,,2019-03-16,2019-03-16,22:30,23:59,,,,,,No
Atlanta Science Festival,Fernbank Forest Bird Walk,"Join a Fernbank wildlife educator and discover more about the feathered inhabitants of Fernbank Forest, both permanent residents and visitors. This program is excellent for beginning birders and those desiring gentle terrain. Binoculars may be checked out on-site. Recommended for ages 8 and up. This event is free with admission or membership, but you must call 404.929.6400 to reserve your spot. Check back for weather updates. Free parking is available on site. More Details AUDIENCE(S): Families (kids & adults together) Adults Teens (13-18 yrs)",https://atlantasciencefestival.org/events-2019/fernbank-forest-bird-walk/,Atlanta,,2019-03-17,2019-03-17,09:00,11:00,,,,,,No
Atlanta Science Festival,Salamander Stroll,This event is SOLD OUT. More tickets will be released on February 25th at 9 amCome on out to Clyde Shepherd Nature Preserve in Decatur and witness wildlife with regional experts from The Amphibian Foundation. Become  citizen scientists  and perform an amphibian  bioblitz  inventory of the preserve documenting salamanders and frogs in one of the last strongholds for amphibians inside of the perimeter! Everyone and their families are encouraged to attend and bring your cell... More Details AUDIENCE(S): Families (kids & adults together) Teens (13-18 yrs) Children (5-12 yrs) Adults,https://atlantasciencefestival.org/events-2019/salamander-stroll/,Decatur,,2019-03-17,2019-03-17,10:00,11:30,,,,,,No
Atlanta Science Festival,"Say Cheese, Please!","Have you ever wondered how creamy goat cheese is made or what makes it so delicious? Come out to Decimal Place Farm, a Saanen goat dairy just 10 miles from our State Capitol. You ll get a chance to practice milking, scoop cheese curds from whey, and visit chickens as they scratch for bugs. We ll take a mild hike through the woods and across the creeks as we search for forest treasures, and visit the farm s... More Details AUDIENCE(S): Families (kids & adults together) Children (5-12 yrs) Teens (13-18 yrs)",https://atlantasciencefestival.org/events-2019/say-cheese-please-1/,Conley,,2019-03-17,2019-03-17,10:00,11:30,,,,,,No
Atlanta Science Festival,Swarm Science: How Honey Bees Make Decisions,"Is it really true that the queen bee calls the shots? How do honeybees communicate and make the best decision for the hive community? Come for a fascinating close-up look at the latest honeybee research, complete with hive observations, a honey tasting, and an outdoor experience at Blue Heron Nature Preserve. Parking available on site. Note: This event repeats on March 16. More Details AUDIENCE(S): Adults Teens (13-18 yrs)",https://atlantasciencefestival.org/events-2019/swarm-science-how-honey-bees-make-decisions-2/,Atlanta,,2019-03-17,2019-03-17,10:00,12:00,,,,,,No
Atlanta Science Festival,Eco-Geo Expedition,"Grab your phone and get ready to hike up Arabia Mountain for a scavenger hunt that includes geocaching, identifying unique species, and finding geologic features beneath your feet! Stop by the nature center to claim your scavenger hunt card before you get started and consider joining a guided hike to learn about plants, insects, and more as you explore the landscape. Learn how to use the iNaturalist, Rockd, and Geocaching apps to record your... More Details AUDIENCE(S): Adults Families (kids & adults together) Children (5-12 yrs) Teens (13-18 yrs)",https://atlantasciencefestival.org/events-2019/eco-geo-expedition/,Lithonia,,2019-03-17,2019-03-17,11:00,14:00,,,,,,No
Atlanta Science Festival,"Say Cheese, Please!","Have you ever wondered how creamy goat cheese is made or what makes it so delicious? Come out to Decimal Place Farm, a Saanen goat dairy just 10 miles from our state s capitol. You ll get a chance to practice milking, scoop cheese curds from whey, and visit chickens as they scratch for bugs. We ll take a mild hike through the woods and across the creeks as we search for forest treasures, and visit the farm s... More Details AUDIENCE(S): Families (kids & adults together) Children (5-12 yrs) Teens (13-18 yrs)",https://atlantasciencefestival.org/events-2019/say-cheese-please-2/,Conley,,2019-03-17,2019-03-17,13:00,14:30,,,,,,No
Atlanta Science Festival,Family Science Carnival,"Sharing our Science: The Paideia School Bring the whole family out for a science carnival mashup! Parents and kids can play with--or against--each other in games based on some of your favorite classic science experiments and beloved carnival games: Air Cannon Shoot, Giant Jenga, Sound Wave Splash, and more! Check back for registration and parking information and for weather-related updates. Note: Parents, please register for yourself in addition to your child. More Details AUDIENCE(S): Families (kids & adults together) Children (5-12 yrs)",https://atlantasciencefestival.org/events-2019/family-science-carnival/,Atlanta,,2019-03-17,2019-03-17,13:00,16:00,,,,,,No
Atlanta Science Festival,Genius Camp: Makers,"SOLD OUT. Please check back in late February to see if we ve had any cancellations.Join in the maker movement at Georgia State University s EXLAB! Learn how to create a 3D design, scan an object and prepare it for 3D printing, solder your own Georgia State University LED keepsake, view a demo of the laser cutter, and practice on a sewing machine. Free parking available in GSU G Deck. Enter at the Collins Street Entrance... More Details AUDIENCE(S): Families (kids & adults together) Children (5-12 yrs) Teens (13-18 yrs)",https://atlantasciencefestival.org/events-2019/genius-camp-makers-3/,Atlanta,,2019-03-17,2019-03-17,13:00,16:00,,,,,,No
Atlanta Science Festival,Udderly Amazing,"Ever wonder how ice cream is made? Join UGA Extension Fulton County and the Georgia Mobile Dairy Classroom to learn about the dairy industry and to participate in a live milking demonstration. You will even be able to get up close and personal with a real live dairy cow! Afterwards, make your own yummy ice cream and learn about the nutrition behind milk and dairy products. It s going to be legen-dairy! Note: There will be two... More Details AUDIENCE(S): Families (kids & adults together) Children (5-12 yrs) Preschool (0-4 yrs) Teens (13-18 yrs)",https://atlantasciencefestival.org/events-2019/udderly-amazing/,Atlanta,,2019-03-17,2019-03-17,14:00,15:45,,,,,,No
Atlanta Science Festival,Roadside Geology,"Tag along with two geologist-educators to see the beautiful building stones and folded natural rock layers of Midtown Atlanta, on a tour from Symphony Hall to Rhodes Hall. Dr. Bill Witherspoon, co-author of Roadside Geology of Georgia, teams up with highly sought guest speaker from Georgia Mineral Society and Atlanta Geological Society, Bill Waggener, to interpret the stories that rocks tell. Each attendee will receive a Georgia Mineral Society grab bag. Meet in the parking... More Details AUDIENCE(S): Adults Teens (13-18 yrs)",https://atlantasciencefestival.org/events-2019/roadside-geology-1/,Atlanta,,2019-03-17,2019-03-17,14:00,17:00,,,,,,No
Atlanta Science Festival,Astronaut or Aquanaut?,"In this corner, we have ASTRONAUT in the spacesuit! In this corner, we have AQUANAUT in the wetsuit! Who will be the ultimate explorer?!? Join Jennifer Swanson, author of children's book Astronaut or Aquanaut, for a debate with interactive questions and help us compare and contrast the benefits of each extreme environment. This exciting event will have you soaring into space or diving deep into the ocean. This program is best for children in first grade... More Details AUDIENCE(S): Families (kids & adults together) Children (5-12 yrs)",https://atlantasciencefestival.org/events-2019/astronaut-or-aquanaut/,Atlanta,,2019-03-17,2019-03-17,15:00,16:00,,,,,,No
Atlanta Science Festival,Constellations,"Earth to Sky Performance Company presents Constellations, an exploration of star stories. This hour long theatrical show uses creative movement both on the ground and in the air to interpret the ancient stories behind the night sky s luminous formations. From the Native American myth explaining the creation of the Milky Way to the Greek epic of Hercules and the dragon, this enthralling show imbues ancient tales with the excitement of aerial arts. Earth to Sky is... More Details AUDIENCE(S): Adults Families (kids & adults together) Teens (13-18 yrs) Children (5-12 yrs)",https://atlantasciencefestival.org/events-2019/constellations/,Decatur,,2019-03-17,2019-03-17,15:00,16:30,,,,,,No
Atlanta Science Festival,Splash into Stream Science,"Examine the world of water in your own backyard by catching and studying bugs that reveal the health of a local stream in southwestern Atlanta. Test water quality and learn how changing environmental conditions can affect the livelihood of habitats and how that relates to human activities. Join in games and engage in laboratory and field science at different stations next to the creek, or jump in and  get your feet wet  to participate in... More Details AUDIENCE(S): Adults Families (kids & adults together) Teens (13-18 yrs) Children (5-12 yrs) Preschool (0-4 yrs)",https://atlantasciencefestival.org/events-2019/splash-into-stream-science/,Atlanta,,2019-03-17,2019-03-17,15:00,17:00,,,,,,No
Atlanta Science Festival,ChangeMaker Faire,"Sharing our Science: Amana Academy Charter School Build a better world at the ChangeMaker Faire! Think county fair with science mixed in, and so much more! The ChangeMaker Faire is an all-ages gathering of tech enthusiasts, crafters, educators, tinkerers, hobbyists, engineers, science clubs, students, and commercial exhibitors on the STEM-certified Amana Academy charter school campus. All of these  makers  come together to show what they have made and to share what they have learned. Visitors will... More Details AUDIENCE(S): Adults Families (kids & adults together) Teens (13-18 yrs) Children (5-12 yrs) Educators",https://atlantasciencefestival.org/events-2019/changemaker-faire/,Alpharetta,,2019-03-17,2019-03-17,15:00,18:00,,,,,,No
Atlanta Science Festival,Mike Mongo's Astronaut Job Fair,"Space YouTuber, Space plumber, Space athlete, even Space Fortnite will be some of career opportunities presented for middle-grade students at the Atlanta Science Festival debut of the space STEAM career program, Astronaut Job Fair. Astronaut Job Fair (AJF) is a professional Space job training workshop for middle-grade students, ages 9-13. Staged as a real professional job fair and career day, AJF at ASF will inspire and encourage young students with a flair for STEAM towards... More Details AUDIENCE(S): Children (5-12 yrs) Teens (13-18 yrs)",https://atlantasciencefestival.org/events-2019/mike-mongos-astronaut-job-fair/,Atlanta,,2019-03-18,2019-03-18,08:00,16:00,,,,,,No
Atlanta Science Festival,Beatrice the Biologist: Comic Strip Science,"Meet and greet Beatrice the Biologist. You might have seen her science comics on the internet, but now's your chance to see the scientist behind it all. In this workshop, you'll learn how to draw your own science cartoons featuring amoeba hugs, dinosaur farts, and much, much more. Come to Manuel's at 7:30 to grab dinner and drinks with comics for dessert! PS: No art skills required! More Details AUDIENCE(S): Adults Teens (13-18 yrs) Families (kids & adults together)",https://atlantasciencefestival.org/events-2019/beatrice-the-biologist-comic-strip-science/,Atlanta,,2019-03-18,2019-03-18,19:00,21:00,,,,,,No
Atlanta Science Festival,Frogs Fly Home: A Conservation Success Story,"Fourteen years ago, a group of scientists raced to evacuate frogs from the wilds of Panama to protect them from a deadly chytrid fungus that was sweeping the region. After more than a decade of quarantine, the remaining populations of two Panamanian frog species have been reunited. Join Chelsea Thomas, Amphibian Conservation Coordinator at the Atlanta Botanical Garden, as she discusses recent research on the chytrid fungus, her first-hand experiences of traveling with these frogs,... More Details AUDIENCE(S): Teens (13-18 yrs) Children (5-12 yrs)",https://atlantasciencefestival.org/events-2019/frogs-fly-home-a-conservation-success-story-1/,Atlanta,,2019-03-19,2019-03-19,10:30,11:30,,,,,,No
Atlanta Science Festival,It s My Brain! My Brain Made Me Do It!,"Have you ever wondered what a human brain looks and feels like in person? How your brain works and influences the way you behave? Why some animals are more aggressive than others? What the inside of a sheep brain looks and feels like? Follow your curiosity to Morehouse College, and join us for interactive activities and demonstrations with three psychology professors with expertise in neuroscience and animal behavior. Driving directions to Morehouse College can be found... More Details AUDIENCE(S): Children (5-12 yrs) Families (kids & adults together) Teens (13-18 yrs)",https://atlantasciencefestival.org/events-2019/its-my-brain-my-brain-made-me-do-it/,Atlanta,,2019-03-19,2019-03-19,16:00,18:00,,,,,,No
Atlanta Science Festival,Bio-Bus: Animal Diversity,"Are humans more closely related to bears or beetles? Join the Georgia State University Bio-Bus as a junior taxonomist to explore the animal kingdom from sponges and corals to bugs, octopuses, and mammals! You ll use diverse animals  DNA sequences to create an animal  family tree.  Contact Wendy Herbert at 770-270-8230 to sign up. Parents need only register for their child (children), not themselves. This event is best suited for children 5-10 years old and their... More Details AUDIENCE(S): Families (kids & adults together) Children (5-12 yrs)",https://atlantasciencefestival.org/events-2019/bio-bus-animal-diversity/,Chamblee,,2019-03-19,2019-03-19,17:00,19:00,,,,,,No
Atlanta Science Festival,Cobb 4-H Family Science Night,"Come join the fun at Family Science Night with Cobb County 4-H as you explore science through hands-on and engaging activities! Rotate through various stations to explore concepts such as food science, animal science, agriscience, biological science, and more! There will be door prizes, learning, and of course plenty of fun! Drop in any time during the event. Note: Parents, please register for yourself in addition to your child. More Details AUDIENCE(S): Families (kids & adults together) Children (5-12 yrs)",https://atlantasciencefestival.org/events-2019/cobb-4-h-family-science-night/,Marietta,,2019-03-19,2019-03-19,18:00,20:00,,,,,,No
Atlanta Science Festival,Buzz on Bees,"Curious about the plight of the bees and what is being done to save them? Dr. Jennifer Leavey, Director of the Georgia Tech Urban Honey Bee Project, will present a summary of cutting-edge bee-related research from around the world published over the course of the last year. More Details AUDIENCE(S): Adults Teens (13-18 yrs)",https://atlantasciencefestival.org/events-2019/buzz-on-bees/,Atlanta,,2019-03-19,2019-03-19,19:00,20:00,,,,,,No
Atlanta Science Festival,Frogs Fly Home: A Conservation Success Story,"Fourteen years ago, a group of scientists raced to evacuate frogs from the wilds of Panama to protect them from a deadly chytrid fungus that was sweeping the region. After more than a decade of quarantine, the remaining populations of two Panamanian frog species have been reunited. Join Chelsea Thomas, Amphibian Conservation Coordinator at the Atlanta Botanical Garden, as she discusses recent research on the chytrid fungus, her first-hand experiences of traveling with these frogs,... More Details AUDIENCE(S): Teens (13-18 yrs) Adults Families (kids & adults together)",https://atlantasciencefestival.org/events-2019/frogs-fly-home-a-conservation-success-story-2/,Atlanta,,2019-03-19,2019-03-19,19:00,20:00,,,,,,No
Atlanta Science Festival,Science Trivia!,"What is the name for the last column of elements in the periodic table? What type of star is the sun? Other than dolphins, name another animal that uses echolocation. Know the answers? Stumped? Come on out and test your knowledge in three rousing rounds of science trivia! Better start thinking of your best team name now; we expect the house to be packed. Doors open at 6:30. More Details AUDIENCE(S): Adults",https://atlantasciencefestival.org/events-2019/science-trivia/,Atlanta,,2019-03-19,2019-03-19,19:00,21:00,,,,,,No
Atlanta Science Festival,The Story Collider,"The Story Collider brings true, personal stories about science to life. At this live show, you'll hear scientists tell heartwarming (and heartbreaking) stories about their failures, successes, and everything in between, and you'll also hear from people who haven't had a formal connection to science in years. Science is a part of all of our lives and The Story Collider brings chemists, comedians, actors, neuroscientists, writers, and physicists alike onto the stage to tell their... More Details AUDIENCE(S): Adults",https://atlantasciencefestival.org/events-2019/the-story-collider/,Atlanta,,2019-03-19,2019-03-19,20:00,21:30,,,,,,No
Atlanta Science Festival,Science at the Benz,"Our new hometown marvel, Mercedes-Benz Stadium, is not only home to Atlanta United, the Falcons, and thousands of screaming fans, but also to mind-blowing STEM in action. Join us for guided STEM tours of the stadium PLUS a special screening of Science Fair, a National Geographic Documentary Film following nine students competing in the International Science and Engineering Fair. This event is for pre-arranged school field trips as well as general admissions. Tickets are only... More Details AUDIENCE(S): Families (kids & adults together) Children (5-12 yrs)",https://atlantasciencefestival.org/events-2019/science-at-the-benz/,Atlanta,,2019-03-20,2019-03-20,09:00,13:30,,,,,,No
Atlanta Science Festival,Outdoor STEAM,"Join the West Atlanta Watershed Alliance and a host of partners to experience O-STEAM, Outdoor Science, Technology, Engineering, the Arts, and Math at the 26-acre Outdoor Activity Center in Southwest Atlanta, a part of the Atlanta Children's Forest Network! This amazing and engaging hands-on experience will celebrate the urban forest, urban watersheds, wildlife, the arts, and  going green  technologies that advance urban sustainability and combat climate change. Learn about pollinators, plants, amphibians, birds, water, community... More Details AUDIENCE(S): Children (5-12 yrs) Families (kids & adults together)",https://atlantasciencefestival.org/events-2019/outdoor-steam/,Atlanta,,2019-03-20,2019-03-20,09:00,14:00,,,,,,No
Atlanta Science Festival,Bio-Bus: Chemistry: States of Matter,"Put on your goggles, don your gloves, and become a junior scientist as you engage in activities to learn about states of matter and the properties of these different states, all while making witches brew, slime and gak! To sign up for this event, contact Dedra Roman at (678) 398-5828. Parents need only register for their child (children), not themselves. Free parking is available at the library. Sessions start at 3:30, 4:30 and 5:30. More Details AUDIENCE(S): Families (kids & adults together) Teens (13-18 yrs) Children (5-12 yrs)",https://atlantasciencefestival.org/events-2019/bio-bus-chemistry-states-of-matter/,Mableton,,2019-03-20,2019-03-20,15:30,18:30,,,,,,No
Atlanta Science Festival,Is Cursive Still a Thing? Calligraphy & Cocktails,"Is writing by hand pass ? Do keyboards replace the need for cursive? Join us at this hands-on event to learn the science of why handwriting still matters. As you sip on selected specialty cocktails, you'll get to try your hand at different calligraphy styles and learn more about what happens in your brain while you write. Each admission comes with 3 drink tickets. Food is available for purchase. More Details AUDIENCE(S): Adults",https://atlantasciencefestival.org/events-2019/is-cursive-still-a-thing-calligraphy-cocktails/,Decatur,,2019-03-20,2019-03-20,18:30,20:30,,,,,,No
Atlanta Science Festival,Science on Stage: The Forgotten Organ,"The human microbome is a dynamic collection of bacteria, fungi, and viruses central to our survival, shaping every one of us from birth. Acclaimed writer Ed Yong wrote of this ""forgotten organ"" in his masterpiece I Contain Multitudes: The Microbes Within Us and a Grander View of Life. Now, his written word has provided inspiration for four nationally known playwrights who engaged in a 48 hour marathon of isolated furious writing, emerging with four newly-formed... More Details AUDIENCE(S): Adults Teens (13-18 yrs)",https://atlantasciencefestival.org/events-2019/science-on-stage-the-forgotten-organ/,Atlanta,,2019-03-20,2019-03-20,18:30,21:30,,,,,,No
Atlanta Science Festival,Choose Your Own (Climate) Adventure!,"The climate is set to warm 1.5 degrees in the next dozen years. Can you and your friends avert the climate crisis?! Maybe; but it ll be a little bit harder given incomplete information. Face censorship in climate science head on in this choose-your-own adventure activity, and hear from local scientists about how we can craft policies to keep our planet habitable for the foreseeable future. Grab a beer and a bud and see if you can crack... More Details AUDIENCE(S): Adults Teens (13-18 yrs)",https://atlantasciencefestival.org/events-2019/choose-your-own-climate-adventure/,Atlanta,,2019-03-20,2019-03-20,19:00,21:00,,,,,,No
Atlanta Science Festival,Science Improv,"It's improv comedy with a science twist! Come see experienced improv actors and professional scientists take the stage together to put on a unique entertainment and educational experience. The audience will provide scientific suggestions to drive the performance, and you're sure to have a great time and come away having learned something too! Comedy improvisation has never been geekier. More Details AUDIENCE(S): Teens (13-18 yrs) Adults",https://atlantasciencefestival.org/events-2019/science-improv/,Atlanta,,2019-03-20,2019-03-20,19:30,21:30,,,,,,No
Atlanta Science Festival,Bio-Bus: Elementary Weather,"Sunny with a chance of rain! Join the Georgia State University Bio-Bus and become a junior meteorologist as you learn about how clouds form, and what forces of nature produce weather. You ll also get to make your own tornado in a bottle, so don't forget to bring your own empty plastic water bottle. This event is best suited for children 5-10 years old and their families. Contact Angiah Davis at 404-613-3092 to sign up. Parents... More Details AUDIENCE(S): Families (kids & adults together) Children (5-12 yrs)",https://atlantasciencefestival.org/events-2019/bio-bus-elementary-weather/,Union,,2019-03-21,2019-03-21,10:30,11:30,,,,,,No
Atlanta Science Festival,Roadside Geology,"Tag along with two geologist-educators to see the beautiful building stones and folded natural rock layers of Midtown Atlanta, on a tour from Symphony Hall to Rhodes Hall. Dr. Bill Witherspoon, co-author of Roadside Geology of Georgia, teams up with highly sought guest speaker from Georgia Mineral Society and Atlanta Geological Society, Bill Waggener, to interpret the stories that rocks tell. Each attendee will receive a Georgia Mineral Society grab bag. Meet in the south... More Details AUDIENCE(S): Adults Teens (13-18 yrs)",https://atlantasciencefestival.org/events-2019/roadside-geology-2/,Atlanta,,2019-03-21,2019-03-21,13:00,16:00,,,,,,No
